{"$defs":{"absolutePath":{"pattern":"^/(?:[A-Za-z0-9._+-]+/)*[A-Za-z0-9._+-]+$","type":"string"},"digest":{"pattern":"^[0-9a-f]{64}$","type":"string"},"digestRef":{"additionalProperties":false,"properties":{"id":{"$ref":"#/$defs/id"},"sha256":{"$ref":"#/$defs/digest"}},"required":["id","sha256"],"type":"object"},"hex32":{"pattern":"^[0-9a-f]{32}$","type":"string"},"hex40":{"pattern":"^[0-9a-f]{40}$","type":"string"},"id":{"pattern":"^[a-z0-9][a-z0-9._-]{0,63}$","type":"string"},"licenseRef":{"additionalProperties":false,"properties":{"decision":{"enum":["affirmative","informational","restricted","user-supplied"]},"id":{"$ref":"#/$defs/id"},"text_sha256":{"$ref":"#/$defs/digest"}},"required":["id","text_sha256","decision"],"type":"object"},"path":{"not":{"pattern":"(?:^|/)(?:\\.|\\.\\.)(?:/|$)|//"},"pattern":"^[a-z0-9][a-z0-9._/-]{0,255}$","type":"string"},"positive":{"maximum":9223372036854775807,"minimum":1,"type":"integer"},"resourcePath":{"not":{"pattern":"(?:^|/)(?:\\.|\\.\\.)(?:/|$)|//"},"pattern":"^[A-Za-z0-9][A-Za-z0-9._/-]{0,255}$","type":"string"},"s64":{"maximum":9223372036854775807,"minimum":0,"type":"integer"},"systemRef":{"additionalProperties":false,"properties":{"id":{"$ref":"#/$defs/id"},"manifest_sha256":{"$ref":"#/$defs/digest"}},"required":["id","manifest_sha256"],"type":"object"},"text":{"maxLength":4096,"minLength":1,"type":"string"},"textMaybeEmpty":{"maxLength":4096,"type":"string"},"u32":{"maximum":4294967295,"minimum":0,"type":"integer"},"u64":{"maximum":18446744073709551615,"minimum":0,"type":"integer"}},"$id":"kilix.content.capacity-reserve/v2","$schema":"https://json-schema.org/draft/2020-12/schema","additionalProperties":false,"properties":{"filesystem_floor_formulas":{"items":{"additionalProperties":false,"properties":{"filesystem_type":{"pattern":"^[a-z0-9][a-z0-9._+-]{0,31}$","type":"string"},"fixed_min_bytes":{"$ref":"#/$defs/positive"},"fixed_min_inodes":{"$ref":"#/$defs/positive"},"hardware_tier":{"$ref":"#/$defs/id"},"metadata_bytes_per_inode":{"$ref":"#/$defs/positive"},"overflow_mode":{"const":"checked-s64"},"proportional_denominator":{"$ref":"#/$defs/positive"},"proportional_numerator":{"$ref":"#/$defs/positive"},"rounding_mode":{"const":"checked-ceil"}},"required":["hardware_tier","filesystem_type","fixed_min_bytes","proportional_numerator","proportional_denominator","fixed_min_inodes","metadata_bytes_per_inode","overflow_mode","rounding_mode"],"type":"object"},"maxItems":64,"minItems":1,"type":"array","uniqueItems":true},"hardware_tier":{"const":"test-vector"},"ledger_schema":{"const":"kilix.content.capacity-ledger/v2"},"memory_equation":{"additionalProperties":false,"properties":{"addition":{"const":"checked-s64"},"aggregate_reservation_bytes_max":{"$ref":"#/$defs/positive"},"fixed_overhead_bytes":{"$ref":"#/$defs/positive"},"helper_overheads":{"items":{"additionalProperties":false,"properties":{"memory_bytes_max":{"$ref":"#/$defs/positive"},"name":{"$ref":"#/$defs/id"}},"required":["name","memory_bytes_max"],"type":"object"},"maxItems":3,"minItems":3,"type":"array","uniqueItems":true},"multiplication":{"const":"checked-s64"},"page_rounding":{"const":"checked-ceil"},"page_size_bytes":{"$ref":"#/$defs/positive"},"per_transaction_bytes":{"$ref":"#/$defs/positive"},"simultaneous_transactions_max":{"$ref":"#/$defs/positive"},"tmpfs_bytes_max":{"$ref":"#/$defs/positive"},"transaction_process_bytes_max":{"$ref":"#/$defs/positive"}},"required":["page_size_bytes","fixed_overhead_bytes","transaction_process_bytes_max","tmpfs_bytes_max","helper_overheads","per_transaction_bytes","simultaneous_transactions_max","aggregate_reservation_bytes_max","addition","multiplication","page_rounding"],"type":"object"},"phase_maxima":{"items":{"additionalProperties":false,"properties":{"maximum":{"additionalProperties":false,"properties":{"bytes":{"$ref":"#/$defs/positive"},"directory_entries":{"$ref":"#/$defs/positive"},"files":{"$ref":"#/$defs/positive"},"inodes":{"$ref":"#/$defs/positive"},"retained_crash_states":{"$ref":"#/$defs/positive"}},"required":["bytes","inodes","files","directory_entries","retained_crash_states"],"type":"object"},"owner_kind":{"enum":["capacity","retention-capacity","transaction"]},"phase":{"enum":["RESERVED","SUBMITTER_ARMING","SUBMITTER_LIVE","UNIT_PREPARED","UNIT_MAYBE_SENT","UNIT_ACKNOWLEDGED","UNIT_OBSERVED","UNIT_BOUND","GO_SENT","STAGE_RETAINED","RELEASING","RELEASE_PROOFED","RETENTION_INTENT_RESERVED","RETENTION_ACCOUNTED","RETENTION_HANDOFF_RELEASING","RETENTION_HANDOFF_PROOFED","RETENTION_PREPARED","RETENTION_MARKER_DURABLE","RETENTION_RELATION_DURABLE","RETENTION_READY","RETENTION_HANDOFF_COMPLETE"]},"root_role":{"enum":["install-authorizations-v2","installed-data","license-receipts-v1","resumable-cache","transaction-state"]}},"required":["owner_kind","phase","root_role","maximum"],"type":"object"},"maxItems":256,"minItems":1,"type":"array","uniqueItems":true},"policy_id":{"$ref":"#/$defs/id"},"policy_version":{"$ref":"#/$defs/positive"},"release_id":{"$ref":"#/$defs/id"},"reservation_schema":{"const":"kilix.content.capacity-generation/v2"},"retention_limits":{"additionalProperties":false,"properties":{"ambiguous_retained_objects_max":{"$ref":"#/$defs/positive"},"directory_entry_growth_bytes_max":{"items":{"additionalProperties":false,"properties":{"bytes":{"$ref":"#/$defs/positive"},"filesystem_type":{"pattern":"^[a-z0-9][a-z0-9._+-]{0,31}$","type":"string"}},"required":["filesystem_type","bytes"],"type":"object"},"maxItems":16,"minItems":1,"type":"array","uniqueItems":true},"pending_bytes_max":{"$ref":"#/$defs/positive"},"pending_inodes_max":{"$ref":"#/$defs/positive"},"pending_relations_max":{"$ref":"#/$defs/positive"},"retained_allocated_bytes_max":{"$ref":"#/$defs/positive"},"retained_inodes_max":{"$ref":"#/$defs/positive"},"retained_unique_objects_max":{"$ref":"#/$defs/positive"},"retained_versions_per_stable_slot_max":{"$ref":"#/$defs/positive"}},"required":["retained_unique_objects_max","retained_allocated_bytes_max","retained_inodes_max","retained_versions_per_stable_slot_max","ambiguous_retained_objects_max","pending_relations_max","pending_bytes_max","pending_inodes_max","directory_entry_growth_bytes_max"],"type":"object"},"scan_bounds":{"additionalProperties":false,"properties":{"bytes_max":{"$ref":"#/$defs/positive"},"directory_children_max":{"$ref":"#/$defs/positive"},"filesystems_max":{"$ref":"#/$defs/positive"},"graph_edges_max":{"$ref":"#/$defs/positive"},"graph_nodes_max":{"$ref":"#/$defs/positive"},"journals_max":{"$ref":"#/$defs/positive"},"objects_max":{"$ref":"#/$defs/positive"},"recursion_depth_max":{"$ref":"#/$defs/positive"},"relations_max":{"$ref":"#/$defs/positive"},"reservations_max":{"$ref":"#/$defs/positive"},"retention_records_max":{"$ref":"#/$defs/positive"},"roots_max":{"$ref":"#/$defs/positive"}},"required":["roots_max","filesystems_max","reservations_max","retention_records_max","relations_max","objects_max","journals_max","directory_children_max","graph_nodes_max","graph_edges_max","bytes_max","recursion_depth_max"],"type":"object"},"schema":{"const":"kilix.content.capacity-reserve/v2"},"supported_filesystems":{"items":{"additionalProperties":false,"properties":{"allocation_rounding":{"const":"f-frsize-ceil"},"filesystem_magic":{"$ref":"#/$defs/u64"},"filesystem_type":{"pattern":"^[a-z0-9][a-z0-9._+-]{0,31}$","type":"string"},"identity_policy":{"const":"r7-capacity-key"},"stable_block_semantics":{"const":true}},"required":["filesystem_type","filesystem_magic","allocation_rounding","stable_block_semantics","identity_policy"],"type":"object"},"maxItems":16,"minItems":1,"type":"array","uniqueItems":true},"tier_selection_inputs":{"additionalProperties":false,"properties":{"cpu_class":{"$ref":"#/$defs/id"},"memory_class":{"$ref":"#/$defs/id"},"selection_rule":{"const":"externally-measured-exact-match"},"storage_class":{"$ref":"#/$defs/id"}},"required":["memory_class","cpu_class","storage_class","selection_rule"],"type":"object"},"writable_roots":{"items":{"additionalProperties":false,"properties":{"descriptor_relative":{"const":true},"relative_path":{"$ref":"#/$defs/path"},"role":{"enum":["install-authorizations-v2","installed-data","license-receipts-v1","resumable-cache","transaction-state"]}},"required":["role","relative_path","descriptor_relative"],"type":"object"},"maxItems":5,"minItems":5,"type":"array","uniqueItems":true}},"required":["schema","release_id","policy_id","policy_version","hardware_tier","tier_selection_inputs","ledger_schema","reservation_schema","memory_equation","writable_roots","supported_filesystems","filesystem_floor_formulas","phase_maxima","retention_limits","scan_bounds"],"title":"Kilix capacity policy v2","type":"object"}