{"filesystem_floor_formulas":[{"filesystem_type":"ext4","fixed_min_bytes":4096,"fixed_min_inodes":8,"hardware_tier":"test-vector","metadata_bytes_per_inode":256,"overflow_mode":"checked-s64","proportional_denominator":100,"proportional_numerator":1,"rounding_mode":"checked-ceil"}],"hardware_tier":"test-vector","ledger_schema":"kilix.content.capacity-ledger/v2","memory_equation":{"addition":"checked-s64","aggregate_reservation_bytes_max":65536,"fixed_overhead_bytes":4096,"helper_overheads":[{"memory_bytes_max":1024,"name":"payload-init"},{"memory_bytes_max":1024,"name":"supervisor"},{"memory_bytes_max":1024,"name":"unit-submit"}],"multiplication":"checked-s64","page_rounding":"checked-ceil","page_size_bytes":4096,"per_transaction_bytes":32768,"simultaneous_transactions_max":2,"tmpfs_bytes_max":16384,"transaction_process_bytes_max":8192},"phase_maxima":[{"maximum":{"bytes":1024,"directory_entries":8,"files":8,"inodes":8,"retained_crash_states":2},"owner_kind":"capacity","phase":"GO_SENT","root_role":"install-authorizations-v2"},{"maximum":{"bytes":1024,"directory_entries":8,"files":8,"inodes":8,"retained_crash_states":2},"owner_kind":"capacity","phase":"GO_SENT","root_role":"installed-data"},{"maximum":{"bytes":1024,"directory_entries":8,"files":8,"inodes":8,"retained_crash_states":2},"owner_kind":"capacity","phase":"GO_SENT","root_role":"license-receipts-v1"},{"maximum":{"bytes":1024,"directory_entries":8,"files":8,"inodes":8,"retained_crash_states":2},"owner_kind":"capacity","phase":"GO_SENT","root_role":"resumable-cache"},{"maximum":{"bytes":1024,"directory_entries":8,"files":8,"inodes":8,"retained_crash_states":2},"owner_kind":"capacity","phase":"GO_SENT","root_role":"transaction-state"},{"maximum":{"bytes":1024,"directory_entries":8,"files":8,"inodes":8,"retained_crash_states":2},"owner_kind":"capacity","phase":"RELEASE_PROOFED","root_role":"install-authorizations-v2"},{"maximum":{"bytes":1024,"directory_entries":8,"files":8,"inodes":8,"retained_crash_states":2},"owner_kind":"capacity","phase":"RELEASE_PROOFED","root_role":"installed-data"},{"maximum":{"bytes":1024,"directory_entries":8,"files":8,"inodes":8,"retained_crash_states":2},"owner_kind":"capacity","phase":"RELEASE_PROOFED","root_role":"license-receipts-v1"},{"maximum":{"bytes":1024,"directory_entries":8,"files":8,"inodes":8,"retained_crash_states":2},"owner_kind":"capacity","phase":"RELEASE_PROOFED","root_role":"resumable-cache"},{"maximum":{"bytes":1024,"directory_entries":8,"files":8,"inodes":8,"retained_crash_states":2},"owner_kind":"capacity","phase":"RELEASE_PROOFED","root_role":"transaction-state"},{"maximum":{"bytes":1024,"directory_entries":8,"files":8,"inodes":8,"retained_crash_states":2},"owner_kind":"capacity","phase":"RELEASING","root_role":"install-authorizations-v2"},{"maximum":{"bytes":1024,"directory_entries":8,"files":8,"inodes":8,"retained_crash_states":2},"owner_kind":"capacity","phase":"RELEASING","root_role":"installed-data"},{"maximum":{"bytes":1024,"directory_entries":8,"files":8,"inodes":8,"retained_crash_states":2},"owner_kind":"capacity","phase":"RELEASING","root_role":"license-receipts-v1"},{"maximum":{"bytes":1024,"directory_entries":8,"files":8,"inodes":8,"retained_crash_states":2},"owner_kind":"capacity","phase":"RELEASING","root_role":"resumable-cache"},{"maximum":{"bytes":1024,"directory_entries":8,"files":8,"inodes":8,"retained_crash_states":2},"owner_kind":"capacity","phase":"RELEASING","root_role":"transaction-state"},{"maximum":{"bytes":1024,"directory_entries":8,"files":8,"inodes":8,"retained_crash_states":2},"owner_kind":"capacity","phase":"RESERVED","root_role":"install-authorizations-v2"},{"maximum":{"bytes":1024,"directory_entries":8,"files":8,"inodes":8,"retained_crash_states":2},"owner_kind":"capacity","phase":"RESERVED","root_role":"installed-data"},{"maximum":{"bytes":1024,"directory_entries":8,"files":8,"inodes":8,"retained_crash_states":2},"owner_kind":"capacity","phase":"RESERVED","root_role":"license-receipts-v1"},{"maximum":{"bytes":1024,"directory_entries":8,"files":8,"inodes":8,"retained_crash_states":2},"owner_kind":"capacity","phase":"RESERVED","root_role":"resumable-cache"},{"maximum":{"bytes":1024,"directory_entries":8,"files":8,"inodes":8,"retained_crash_states":2},"owner_kind":"capacity","phase":"RESERVED","root_role":"transaction-state"},{"maximum":{"bytes":1024,"directory_entries":8,"files":8,"inodes":8,"retained_crash_states":2},"owner_kind":"capacity","phase":"STAGE_RETAINED","root_role":"install-authorizations-v2"},{"maximum":{"bytes":1024,"directory_entries":8,"files":8,"inodes":8,"retained_crash_states":2},"owner_kind":"capacity","phase":"STAGE_RETAINED","root_role":"installed-data"},{"maximum":{"bytes":1024,"directory_entries":8,"files":8,"inodes":8,"retained_crash_states":2},"owner_kind":"capacity","phase":"STAGE_RETAINED","root_role":"license-receipts-v1"},{"maximum":{"bytes":1024,"directory_entries":8,"files":8,"inodes":8,"retained_crash_states":2},"owner_kind":"capacity","phase":"STAGE_RETAINED","root_role":"resumable-cache"},{"maximum":{"bytes":1024,"directory_entries":8,"files":8,"inodes":8,"retained_crash_states":2},"owner_kind":"capacity","phase":"STAGE_RETAINED","root_role":"transaction-state"},{"maximum":{"bytes":1024,"directory_entries":8,"files":8,"inodes":8,"retained_crash_states":2},"owner_kind":"capacity","phase":"SUBMITTER_ARMING","root_role":"install-authorizations-v2"},{"maximum":{"bytes":1024,"directory_entries":8,"files":8,"inodes":8,"retained_crash_states":2},"owner_kind":"capacity","phase":"SUBMITTER_ARMING","root_role":"installed-data"},{"maximum":{"bytes":1024,"directory_entries":8,"files":8,"inodes":8,"retained_crash_states":2},"owner_kind":"capacity","phase":"SUBMITTER_ARMING","root_role":"license-receipts-v1"},{"maximum":{"bytes":1024,"directory_entries":8,"files":8,"inodes":8,"retained_crash_states":2},"owner_kind":"capacity","phase":"SUBMITTER_ARMING","root_role":"resumable-cache"},{"maximum":{"bytes":1024,"directory_entries":8,"files":8,"inodes":8,"retained_crash_states":2},"owner_kind":"capacity","phase":"SUBMITTER_ARMING","root_role":"transaction-state"},{"maximum":{"bytes":1024,"directory_entries":8,"files":8,"inodes":8,"retained_crash_states":2},"owner_kind":"capacity","phase":"SUBMITTER_LIVE","root_role":"install-authorizations-v2"},{"maximum":{"bytes":1024,"directory_entries":8,"files":8,"inodes":8,"retained_crash_states":2},"owner_kind":"capacity","phase":"SUBMITTER_LIVE","root_role":"installed-data"},{"maximum":{"bytes":1024,"directory_entries":8,"files":8,"inodes":8,"retained_crash_states":2},"owner_kind":"capacity","phase":"SUBMITTER_LIVE","root_role":"license-receipts-v1"},{"maximum":{"bytes":1024,"directory_entries":8,"files":8,"inodes":8,"retained_crash_states":2},"owner_kind":"capacity","phase":"SUBMITTER_LIVE","root_role":"resumable-cache"},{"maximum":{"bytes":1024,"directory_entries":8,"files":8,"inodes":8,"retained_crash_states":2},"owner_kind":"capacity","phase":"SUBMITTER_LIVE","root_role":"transaction-state"},{"maximum":{"bytes":1024,"directory_entries":8,"files":8,"inodes":8,"retained_crash_states":2},"owner_kind":"capacity","phase":"UNIT_ACKNOWLEDGED","root_role":"install-authorizations-v2"},{"maximum":{"bytes":1024,"directory_entries":8,"files":8,"inodes":8,"retained_crash_states":2},"owner_kind":"capacity","phase":"UNIT_ACKNOWLEDGED","root_role":"installed-data"},{"maximum":{"bytes":1024,"directory_entries":8,"files":8,"inodes":8,"retained_crash_states":2},"owner_kind":"capacity","phase":"UNIT_ACKNOWLEDGED","root_role":"license-receipts-v1"},{"maximum":{"bytes":1024,"directory_entries":8,"files":8,"inodes":8,"retained_crash_states":2},"owner_kind":"capacity","phase":"UNIT_ACKNOWLEDGED","root_role":"resumable-cache"},{"maximum":{"bytes":1024,"directory_entries":8,"files":8,"inodes":8,"retained_crash_states":2},"owner_kind":"capacity","phase":"UNIT_ACKNOWLEDGED","root_role":"transaction-state"},{"maximum":{"bytes":1024,"directory_entries":8,"files":8,"inodes":8,"retained_crash_states":2},"owner_kind":"capacity","phase":"UNIT_BOUND","root_role":"install-authorizations-v2"},{"maximum":{"bytes":1024,"directory_entries":8,"files":8,"inodes":8,"retained_crash_states":2},"owner_kind":"capacity","phase":"UNIT_BOUND","root_role":"installed-data"},{"maximum":{"bytes":1024,"directory_entries":8,"files":8,"inodes":8,"retained_crash_states":2},"owner_kind":"capacity","phase":"UNIT_BOUND","root_role":"license-receipts-v1"},{"maximum":{"bytes":1024,"directory_entries":8,"files":8,"inodes":8,"retained_crash_states":2},"owner_kind":"capacity","phase":"UNIT_BOUND","root_role":"resumable-cache"},{"maximum":{"bytes":1024,"directory_entries":8,"files":8,"inodes":8,"retained_crash_states":2},"owner_kind":"capacity","phase":"UNIT_BOUND","root_role":"transaction-state"},{"maximum":{"bytes":1024,"directory_entries":8,"files":8,"inodes":8,"retained_crash_states":2},"owner_kind":"capacity","phase":"UNIT_MAYBE_SENT","root_role":"install-authorizations-v2"},{"maximum":{"bytes":1024,"directory_entries":8,"files":8,"inodes":8,"retained_crash_states":2},"owner_kind":"capacity","phase":"UNIT_MAYBE_SENT","root_role":"installed-data"},{"maximum":{"bytes":1024,"directory_entries":8,"files":8,"inodes":8,"retained_crash_states":2},"owner_kind":"capacity","phase":"UNIT_MAYBE_SENT","root_role":"license-receipts-v1"},{"maximum":{"bytes":1024,"directory_entries":8,"files":8,"inodes":8,"retained_crash_states":2},"owner_kind":"capacity","phase":"UNIT_MAYBE_SENT","root_role":"resumable-cache"},{"maximum":{"bytes":1024,"directory_entries":8,"files":8,"inodes":8,"retained_crash_states":2},"owner_kind":"capacity","phase":"UNIT_MAYBE_SENT","root_role":"transaction-state"},{"maximum":{"bytes":1024,"directory_entries":8,"files":8,"inodes":8,"retained_crash_states":2},"owner_kind":"capacity","phase":"UNIT_OBSERVED","root_role":"install-authorizations-v2"},{"maximum":{"bytes":1024,"directory_entries":8,"files":8,"inodes":8,"retained_crash_states":2},"owner_kind":"capacity","phase":